[
  {
    "rule_id": "M0-SOURCE-001",
    "source_section": "6",
    "statement": "manifest.json identifies namespace ownership, protocol version, repository identity, and the supported schema dialect.",
    "requires_positive": true,
    "requires_negative": true
  },
  {
    "rule_id": "M0-SOURCE-002",
    "source_section": "6",
    "statement": "dossier.json is the sole canonical truth for current governed state.",
    "requires_positive": true,
    "requires_negative": true
  },
  {
    "rule_id": "M0-SOURCE-006",
    "source_section": "6",
    "statement": "Only immutable records referenced by the current dossier snapshot affect current state.",
    "requires_positive": true,
    "requires_negative": true
  },
  {
    "rule_id": "M0-SOURCE-003",
    "source_section": "6",
    "statement": "Handoff, submission, and decision envelopes are immutable create-once records.",
    "requires_positive": true,
    "requires_negative": true
  },
  {
    "rule_id": "M0-SOURCE-007",
    "source_section": "6",
    "statement": "A valid unreferenced envelope whose stored publication facts still target current state is reported as a recoverable orphan and never applied as current truth.",
    "requires_positive": true,
    "requires_negative": true
  },
  {
    "rule_id": "M0-SOURCE-008",
    "source_section": "6",
    "statement": "A valid unreferenced envelope whose stored publication facts target noncurrent state remains superseded immutable history and is not reported as a recoverable orphan.",
    "requires_positive": true,
    "requires_negative": false
  },
  {
    "rule_id": "M0-SOURCE-009",
    "source_section": "6",
    "statement": "An unreadable or structurally invalid immutable-envelope directory makes current-state validation fail with a structural invariant result.",
    "requires_positive": false,
    "requires_negative": true
  },
  {
    "rule_id": "M0-SOURCE-010",
    "source_section": "6",
    "statement": "Failure while scanning one immutable-envelope directory does not prevent every remaining envelope directory from being scanned.",
    "requires_positive": false,
    "requires_negative": true
  },
  {
    "rule_id": "M0-SOURCE-011",
    "source_section": "6",
    "statement": "Each unreferenced envelope's filename ID and dossier ID exactly match the repository address from which it was read.",
    "requires_positive": true,
    "requires_negative": true
  },
  {
    "rule_id": "M0-SOURCE-012",
    "source_section": "6",
    "statement": "Every unreferenced handoff or submission has an exact basis-to-published successor revision pair and does not claim a future basis.",
    "requires_positive": true,
    "requires_negative": true
  },
  {
    "rule_id": "M0-SOURCE-013",
    "source_section": "6",
    "statement": "Every unreferenced submission has an exact self-digest over its complete submission projection.",
    "requires_positive": true,
    "requires_negative": true
  },
  {
    "rule_id": "M0-SOURCE-014",
    "source_section": "6",
    "statement": "Every unreferenced decision resolves to a validated published submission and records that submission's exact digest.",
    "requires_positive": true,
    "requires_negative": true
  },
  {
    "rule_id": "M0-SOURCE-015",
    "source_section": "6",
    "statement": "A current-target unreferenced handoff or submission exactly matches the current basis state digest and canonical content or check projections.",
    "requires_positive": true,
    "requires_negative": true
  },
  {
    "rule_id": "M0-SOURCE-004",
    "source_section": "6",
    "statement": "The locks directory is transient coordination state and is never dossier truth or history.",
    "requires_positive": true,
    "requires_negative": true
  },
  {
    "rule_id": "M0-SOURCE-005",
    "source_section": "6",
    "statement": "M0 has no authoritative brief.md; every human-readable view is generated from canonical data so Markdown cannot become a second editable truth.",
    "requires_positive": true,
    "requires_negative": true
  },
  {
    "rule_id": "M0-SCALAR-001",
    "source_section": "7",
    "statement": "Every identifier-bearing governed schema field uses the shared opaque-string scalar contract.",
    "requires_positive": true,
    "requires_negative": true
  },
  {
    "rule_id": "M0-SCALAR-002",
    "source_section": "7",
    "statement": "A compatible re-initialization preserves the repository identifier rather than reusing it for another repository identity.",
    "requires_positive": true,
    "requires_negative": false
  },
  {
    "rule_id": "M0-SCALAR-011",
    "source_section": "7",
    "statement": "Dossier identifiers are never reused within one repository.",
    "requires_positive": true,
    "requires_negative": false
  },
  {
    "rule_id": "M0-SCALAR-012",
    "source_section": "7",
    "statement": "Run identifiers are never reused within one dossier.",
    "requires_positive": true,
    "requires_negative": true
  },
  {
    "rule_id": "M0-SCALAR-013",
    "source_section": "7",
    "statement": "Handoff identifiers are never reused within one dossier.",
    "requires_positive": true,
    "requires_negative": true
  },
  {
    "rule_id": "M0-SCALAR-014",
    "source_section": "7",
    "statement": "Submission identifiers are never reused within one dossier.",
    "requires_positive": true,
    "requires_negative": false
  },
  {
    "rule_id": "M0-SCALAR-015",
    "source_section": "7",
    "statement": "Decision identifiers are never reused within one dossier.",
    "requires_positive": true,
    "requires_negative": false
  },
  {
    "rule_id": "M0-SCALAR-016",
    "source_section": "7",
    "statement": "Criterion identifiers are unique within one dossier.",
    "requires_positive": true,
    "requires_negative": true
  },
  {
    "rule_id": "M0-SCALAR-017",
    "source_section": "7",
    "statement": "Evidence identifiers are unique within one dossier.",
    "requires_positive": true,
    "requires_negative": true
  },
  {
    "rule_id": "M0-SCALAR-009",
    "source_section": "7",
    "statement": "Operation identifiers form an idempotency scope within one dossier and basis revision.",
    "requires_positive": true,
    "requires_negative": true
  },
  {
    "rule_id": "M0-SCALAR-010",
    "source_section": "7",
    "statement": "Reusing an operation identifier at a later basis has no global-deduplication guarantee.",
    "requires_positive": false,
    "requires_negative": false
  },
  {
    "rule_id": "M0-SCALAR-003",
    "source_section": "7",
    "statement": "Human-readable titles are display metadata and never identity.",
    "requires_positive": true,
    "requires_negative": true
  },
  {
    "rule_id": "M0-SCALAR-004",
    "source_section": "7",
    "statement": "Revisions are non-negative decimal strings with no leading zero except the value 0.",
    "requires_positive": true,
    "requires_negative": true
  },
  {
    "rule_id": "M0-SCALAR-005",
    "source_section": "7",
    "statement": "Digests use the exact sha256:<lowercase-hex> wire grammar.",
    "requires_positive": true,
    "requires_negative": true
  },
  {
    "rule_id": "M0-SCALAR-006",
    "source_section": "7",
    "statement": "Timestamps use the UTC RFC 3339 wire grammar ending in Z.",
    "requires_positive": true,
    "requires_negative": true
  },
  {
    "rule_id": "M0-SCALAR-007",
    "source_section": "7",
    "statement": "Ordering and concurrency never depend on wall-clock time.",
    "requires_positive": true,
    "requires_negative": false
  },
  {
    "rule_id": "M0-SCALAR-008",
    "source_section": "7",
    "statement": "Machine fields and error codes remain English ASCII and locale-invariant.",
    "requires_positive": true,
    "requires_negative": true
  },
  {
    "rule_id": "M0-PARSE-001",
    "source_section": "8.1",
    "statement": "Governed JSON rejects bytes that are not valid UTF-8 before schema validation.",
    "requires_positive": true,
    "requires_negative": true
  },
  {
    "rule_id": "M0-PARSE-002",
    "source_section": "8.1",
    "statement": "Governed JSON rejects duplicate object member names after JSON escape decoding before schema validation.",
    "requires_positive": true,
    "requires_negative": true
  },
  {
    "rule_id": "M0-PARSE-003",
    "source_section": "8.1",
    "statement": "Governed JSON rejects isolated Unicode surrogates and Unicode noncharacters before schema validation.",
    "requires_positive": true,
    "requires_negative": true
  },
  {
    "rule_id": "M0-PARSE-004",
    "source_section": "8.1",
    "statement": "Protocol JSON rejects numeric values and represents counters and revisions with restricted decimal strings.",
    "requires_positive": true,
    "requires_negative": true
  },
  {
    "rule_id": "M0-PARSE-005",
    "source_section": "8.1",
    "statement": "Governed JSON rejects a byte-order mark unless that artifact contract explicitly permits it.",
    "requires_positive": true,
    "requires_negative": true
  },
  {
    "rule_id": "M0-SCHEMA-001",
    "source_section": "8.2",
    "statement": "Every schema uses JSON Schema Draft 2020-12.",
    "requires_positive": true,
    "requires_negative": true
  },
  {
    "rule_id": "M0-SCHEMA-006",
    "source_section": "8.2",
    "statement": "Every root schema explicitly declares the Draft 2020-12 dialect and a stable $id.",
    "requires_positive": true,
    "requires_negative": true
  },
  {
    "rule_id": "M0-SCHEMA-002",
    "source_section": "8.2",
    "statement": "Protocol version and schema dialect are separate required fields.",
    "requires_positive": true,
    "requires_negative": true
  },
  {
    "rule_id": "M0-SCHEMA-003",
    "source_section": "8.2",
    "statement": "Runtime validation resolves only bundled and pinned named root schemas and references, with no network resolution.",
    "requires_positive": true,
    "requires_negative": true
  },
  {
    "rule_id": "M0-SCHEMA-004",
    "source_section": "8.2",